{
  "version": "1.0",
  "artifact_type": "debt_register",
  "artifact_id": "debt-register-mission-20260410-EDfOAr6F",
  "producer_type": "design-authority",
  "scope": "mission",
  "items": [
    {
      "debt_id": "DEBT-001",
      "severity": "low",
      "kind": "documentation",
      "title": "vote-round and reporting SKILLS.md descriptions still contain Absorbed the former... references",
      "description": "vote-round and reporting SKILLS.md descriptions still contain Absorbed the former... references",
      "introduced_by_task_id": "task-002",
      "owner_type": "orchestration-authority",
      "status": "open"
    }
  ],
  "rollup_by_severity": {
    "low": 1
  },
  "rollup_by_kind": {
    "documentation": 1
  },
  "created_at": "2026-04-10T13:11:41Z"
}
